{
  "$schema": "https://json-schema.org/draft/2020-12/schema",
  "$id": "https://flux.example/schema/scenario-config-v1.schema.json",
  "$comment": "Use scripts/validate_scenario_config.py before adapter use; it applies semantic UTC ordering and ready_for_adapter activation gates.",
  "title": "Flux reusable scenario and energy-resource configuration",
  "type": "object",
  "additionalProperties": false,
  "required": ["schema_version", "scenario", "static_context", "time_series", "resources", "provenance", "uncertainty"],
  "properties": {
    "schema_version": { "const": 1 },
    "scenario": {
      "type": "object",
      "additionalProperties": false,
      "required": ["id", "label", "class", "execution_status", "time_window"],
      "properties": {
        "id": { "type": "string", "pattern": "^[a-z][a-z0-9_]*$" },
        "label": { "type": "string", "minLength": 1 },
        "class": { "enum": ["historical_weather_stress", "historical_operating_condition", "synthetic_stress", "forecast"] },
        "execution_status": { "enum": ["example_only", "ready_for_adapter", "unavailable"] },
        "time_window": { "$ref": "#/$defs/utcWindow" }
      }
    },
    "static_context": {
      "type": "object",
      "additionalProperties": false,
      "required": ["geography", "network"],
      "properties": {
        "geography": { "$ref": "#/$defs/staticReference" },
        "network": { "$ref": "#/$defs/staticReference" }
      }
    },
    "time_series": {
      "type": "object",
      "additionalProperties": false,
      "required": ["demand", "weather", "outage", "availability"],
      "properties": {
        "demand": { "$ref": "#/$defs/timeSeriesReference" },
        "weather": { "$ref": "#/$defs/timeSeriesReference" },
        "outage": { "$ref": "#/$defs/timeSeriesReference" },
        "availability": { "$ref": "#/$defs/timeSeriesReference" }
      }
    },
    "resources": {
      "type": "object",
      "additionalProperties": false,
      "required": ["generation", "storage"],
      "properties": {
        "generation": { "type": "array", "items": { "$ref": "#/$defs/generator" } },
        "storage": { "type": "array", "items": { "$ref": "#/$defs/storage" } }
      }
    },
    "provenance": { "$ref": "#/$defs/provenance" },
    "uncertainty": { "$ref": "#/$defs/uncertainty" }
  },
  "$defs": {
    "utcTimestamp": { "type": "string", "pattern": "^\\d{4}-\\d{2}-\\d{2}T\\d{2}:\\d{2}:\\d{2}Z$" },
    "utcWindow": {
      "type": "object", "additionalProperties": false,
      "required": ["start_utc", "end_utc", "interval_minutes"],
      "properties": {
        "start_utc": { "$ref": "#/$defs/utcTimestamp" },
        "end_utc": { "$ref": "#/$defs/utcTimestamp" },
        "interval_minutes": { "type": "integer", "minimum": 1 }
      }
    },
    "provenance": {
      "type": "object", "additionalProperties": false,
      "required": ["source_id", "url", "retrieved_at_utc", "scope"],
      "properties": {
        "source_id": { "type": "string", "minLength": 1 },
        "url": { "type": "string", "format": "uri" },
        "retrieved_at_utc": { "$ref": "#/$defs/utcTimestamp" },
        "scope": { "type": "string", "minLength": 1 }
      }
    },
    "staticReference": {
      "type": "object", "additionalProperties": false,
      "required": ["artifact_id", "status", "provenance"],
      "properties": {
        "artifact_id": { "type": ["string", "null"] },
        "status": { "enum": ["supported", "unavailable"] },
        "provenance": { "$ref": "#/$defs/provenance" }
      },
      "allOf": [{
        "if": { "properties": { "status": { "const": "supported" } } },
        "then": { "properties": { "artifact_id": { "type": "string", "minLength": 1 } } },
        "else": { "properties": { "artifact_id": { "const": null } } }
      }]
    },
    "timeSeriesReference": {
      "type": "object", "additionalProperties": false,
      "required": ["artifact_id", "status", "unit", "time_basis", "samples", "provenance"],
      "properties": {
        "artifact_id": { "type": ["string", "null"] },
        "status": { "enum": ["supported", "unavailable"] },
        "unit": { "type": "string", "minLength": 1 },
        "time_basis": { "const": "UTC" },
        "samples": { "type": "array", "items": { "$ref": "#/$defs/timeSeriesSample" } },
        "provenance": { "$ref": "#/$defs/provenance" }
      },
      "allOf": [{
        "if": { "properties": { "status": { "const": "supported" } } },
        "then": { "properties": { "artifact_id": { "type": "string", "minLength": 1 }, "samples": { "minItems": 1 } } },
        "else": { "properties": { "artifact_id": { "const": null }, "samples": { "maxItems": 0 } } }
      }]
    },
    "timeSeriesSample": {
      "type": "object", "additionalProperties": false,
      "required": ["ts_utc", "value"],
      "properties": { "ts_utc": { "$ref": "#/$defs/utcTimestamp" }, "value": { "type": "number" } }
    },
    "evidencedQuantity": {
      "type": "object", "additionalProperties": false,
      "required": ["value", "unit", "status", "provenance"],
      "properties": {
        "value": { "type": ["number", "null"], "minimum": 0 },
        "unit": { "type": "string", "minLength": 1 },
        "status": { "enum": ["supported", "unsupported"] },
        "provenance": { "$ref": "#/$defs/provenance" }
      },
      "allOf": [{
        "if": { "properties": { "status": { "const": "supported" } } },
        "then": { "properties": { "value": { "type": "number", "minimum": 0 } } },
        "else": { "properties": { "value": { "const": null } } }
      }]
    },
    "generator": {
      "type": "object", "additionalProperties": false,
      "required": ["resource_id", "fuel", "ramp_mw_per_min"],
      "properties": {
        "resource_id": { "type": "string", "minLength": 1 },
        "fuel": { "type": "string", "minLength": 1 },
        "ramp_mw_per_min": { "$ref": "#/$defs/evidencedQuantity" }
      }
    },
    "storage": {
      "type": "object", "additionalProperties": false,
      "required": ["resource_id", "power_mw", "energy_mwh", "state_of_charge"],
      "properties": {
        "resource_id": { "type": "string", "minLength": 1 },
        "power_mw": { "$ref": "#/$defs/evidencedQuantity" },
        "energy_mwh": { "$ref": "#/$defs/evidencedQuantity" },
        "state_of_charge": { "$ref": "#/$defs/evidencedQuantity" }
      }
    },
    "uncertainty": {
      "type": "object", "additionalProperties": false,
      "required": ["level", "notes"],
      "properties": {
        "level": { "enum": ["low", "medium", "high"] },
        "notes": { "type": "array", "minItems": 1, "items": { "type": "string", "minLength": 1 } }
      }
    }
  }
}
